Tweet_count,Username,Text,Created At,Retweets,Likes
118,Sir Maina ™,"Kenya's Ministry of Education is on alert:

🔔 Parents are colluding with teachers to register Grade 7 students for the final KCPE under the 8-4-4 system

❌ The parents don't have confidence in  the CBC system. https://t.co/PpEFAszX98",Wed Feb 15 08:13:06 +0000 2023,2,4
119,Winnie🇺🇸🇿🇦🇰🇪,"@KeruboStar The construction of 27,000 classrooms is helping to ensure that Kenyan children have access to quality learning environments, enabling them to succeed in the new CBC curriculum.#ResultsYouCanSee 
Feel The Transformation",Fri Feb 07 08:06:49 +0000 2025,0,0
120,maitha,"This year, Grade 9 CBC students will sit the KJSEA (Kenya Junior Secondary Education Assessment) to determine their senior secondary placement, yet there is no clarity on textbooks, and some schools don’t even have classrooms.",Tue Jan 07 16:36:08 +0000 2025,3,1
121,"Ministry of Education, Kenya (MoE)","Basic Education PS Dr. Belio Kipsang addresse  school management, grade nine students and monitoring classrooms  during 1st Term Schools opening day in various schools in Nairobi and Kiambu Counties today. The PS said  the  Ministry is ready to fully implement  the CBC programme. https://t.co/5UzYP5sNXn",Mon Jan 06 10:53:58 +0000 2025,4,17
122,NTV Kenya,"Thousands of Kenyans have withdrawn their children from the competency-based curriculum (CBC) and enrolled them in schools offering international syllabus.

https://t.co/VbzDmbG2Ig https://t.co/3Geg0PzKoG",Sat May 28 12:24:35 +0000 2022,363,1995
123,Kenyans.co.ke,There has never been CBC in our classrooms. - Wilson Sossion. https://t.co/KymrLM4XKD,Mon Feb 14 11:14:20 +0000 2022,211,1537
124,Citizen TV Kenya,"CRYING FOR HELP: Student fails to join Kapsabet Boys due to lack of fees, Kiprono scored 417 marks in last year’s KCPE exams, Boy urges well-wishers to help realize his dreams https://t.co/E13ytdydPW",Wed Jan 10 12:45:16 +0000 2018,310,567
125,Citizen TV Kenya,"Wilson Sossion - Former Sec. Gen., KNUT: CBC is a fraudulent curriculum that is being forced on the nation of Kenya &amp; it was rolled out without a professional perspective
#DayBreak
@TrevorOmbija https://t.co/vdr3Ih81yS",Wed Aug 25 03:54:25 +0000 2021,80,225
126,Keith Ang'ana,"In Makau Mutua's article, he talks about Kenya's education crisis, from the A-Levels, which was quite elitist and held back many students from proceeding to uni, to the 8-4-4 system, which didn't build a reading culture, and now the CBC system, which is under-funded and rushed. https://t.co/veMIQ78kJS",Sun Jan 12 09:44:47 +0000 2025,5,26
127,Oscar Sudi Commentary,"@TruthfullBoy More teachers, better education! With 76,000 new teachers, schools across Kenya are now better equipped to handle CBC, providing students with the skills they need to succeed. President Ruto is investing in the future.
#ResultsYouCanSee 

Feel The Transformation",Fri Feb 07 07:57:32 +0000 2025,0,0
128,Kithure Kindiki (Commentary),"@KeruboStar The CBC transition was seamless with 27K new classrooms and 76K teachers hired, ensuring quality education for 3M junior secondary learners. Kenya’s education future is brighter than ever. #ResultsYouCanSee Feel The Transformation",Fri Feb 07 08:00:12 +0000 2025,0,0
129,Wild🌹,"@KeruboStar Kenyan students deserve the best! The hiring of 76,000 teachers, including 20,000 in December, ensures smaller class sizes, improved learning, and better CBC implementation. 
#ResultsYouCanSee 

Feel The Transformation",Fri Feb 07 07:58:52 +0000 2025,1,1
130,Citizen TV Kenya,"A-student fees plea:

Bright Kisii student remains at home due to lack of college fees. Janet Isaboke scored A in KCSE and secured admission at UoN.

Isaboke wants to pursue degree in medicine and surgery #CitizenWeekend https://t.co/JC9lWunCul",Sat Sep 11 18:29:24 +0000 2021,118,483
131,Citizen TV Kenya,"Tops students Bruce Magata Makenzi, Momanyi Ashley Kerubo and Nicole Sang speak on their future ambitions 
#MondayReport https://t.co/5MnqFzoSJu",Mon Mar 28 18:40:03 +0000 2022,25,220
132,Citizen TV Kenya,"Kennedy Echesa – Lecturer: CBC curriculum is not working, it was designed for the rich &amp; an enlightened society…...our society cannot afford to meet the requirements for CBC this is because it is very expensive for our economy &amp; our parents

#DayBreak
@TrevorOmbija https://t.co/gcA4tgZNJb",Wed Aug 25 03:46:28 +0000 2021,65,199
133,Mwalimu Amunga Peter,"Make THE TEACHER  core shaper &amp; implementor of  the  ever-evolving landscape of Kenya’s education sector like adaptation of CBC introduced in 2017 that  has presented unique challenges &amp; opportunities for educators, students, and parents alike. 
#ClassesApart @ntvkenya @Kewota_Ke",Sun Oct 22 18:50:54 +0000 2023,1,2
134,Kisia Nzuki,"CBC is an educational approach that focuses on what students can do, rather than what they know. Is it the real deal in Kenya or it's a scam? https://t.co/MKIo2n55y5",Sun Nov 17 14:02:59 +0000 2024,9,45
135,KBC Channel 1 News,"The University of Nairobi Student Council has listed areas of concern they want President William Ruto to address.

#KBCniYetu https://t.co/hRk0spEyJB",Sat Jun 29 11:35:26 +0000 2024,227,1274
136,THEE ALFA HOUSE,"Rough Start for Schools Amidst Challenges in Kenya's Education Sector

As schools reopen in Kenya, the education sector is grappling with significant challenges, including delays in disbursing capitation funds and inadequate facilities for Grade 9 students under the CBC.",Mon Jan 06 03:31:04 +0000 2025,1,7
137,BBC News (World),Kenya's CBC education reform: How scarecrows are terrifying parents https://t.co/TD9f3tH2ki,Sat Sep 18 01:14:33 +0000 2021,36,170
138,CapitalFM Breaking News,"KENYA Airways hands over a Boeing B737-700 aircraft to Mang'u High school in support of CBC; CS Murkomen it will harness talent, sharpen students' interests. https://t.co/gq3NDI8Ydl",Wed Sep 20 08:47:56 +0000 2023,2,7
139,Citizen TV Kenya,"Wilson Sossion: We are cheating ourselves as a country because there has never been CBC in our classes, teachers are teaching outcome-based curriculum. When a curriculum is not accepted by parents and children are not excited about it, it’s a wrong curriculum #DayBreak https://t.co/PkgrkJ4on6",Fri Sep 16 04:26:59 +0000 2022,53,304
140,Citizen TV Kenya,"CBC road ahead:

I’m not against CBC… We can still develop competencies within the 8-4-4 system of education - Prof. Hillary Barchok #MondayReport @TrevorOmbija https://t.co/FNLd8wRuaT",Mon Oct 03 20:18:47 +0000 2022,27,368
141,Citizen TV Kenya,"Students ignore university slots: 

600,000 students who qualified fail to apply. Education ministry puzzled by low interest in the slots

153,000 students placed in private and public universities. 11,000 who qualified opted for diploma courses

#CitizenExplainer @YvonneOkwara https://t.co/v5Gav7tJ2S",Tue May 21 18:14:50 +0000 2024,150,261
142,TUKO.co.ke | The Heartbeat of Kenya,"Ever tried to teach one pupil alone? Now picture two teachers assigned to teach 70 pupils 14 subjects!

School headteachers have been forced to improvise to ensure that the students learn accordingly.
#CBC #tukonews #EducationForAll 
https://t.co/UwDiQZOoi0",Thu Mar 30 01:26:17 +0000 2023,0,1
143,Citizen TV Kenya,Education CS George Magoha at Ushirika Secondary School for commissioning of CBC classrooms https://t.co/2SqeSBZ44i,Wed Sep 07 08:52:32 +0000 2022,3,237
144,Kabando Wa Kabando,"Crisis hitting education sector, lecturers without salaries, Varsities defunded, CBC limps. Bandits closing schools, University students dropping out of class as HELB goes empty. Spiralling national adversities, Ruto's 50 CASs #HustlerNation.

3yrs ago:

https://t.co/YGrEJVlW9b",Thu Mar 23 14:22:26 +0000 2023,9,22
145,Citizen TV Kenya,"Kennedy Echesa: CBC is not working because it is a curriculum designed for the rich, it discriminates against the children of the poor, discriminates against parents who are not well informed and who cannot support their children in doing the anticipated assignments #MondayReport https://t.co/ThIQaaHFnK",Mon Sep 19 19:22:20 +0000 2022,197,1114
146,The Standard Digital,"Kenya’s education sector is preparing for significant changes as the first cohort of students under the new Competency-Based Curriculum (CBC) transitions into Grade 9 this week.
https://t.co/rCbMi5u1Hw",Mon Jan 06 09:00:16 +0000 2025,3,12
147,The Blood Pressure Champion 🇺🇸,"Does the CBC curriculum teach students about heart disease? 
What we learn in school should be applicable in real life. I learnt about Pressure in physics but blood pressure wasn’t one of the examples given. 
I urge the the Kenya Institute of character development to consider",Wed Jun 14 17:21:21 +0000 2023,1,11
148,kennedyotieno,"While Tanzania is busy educating its future generations, Kenya is all over the place with CBC nonsense asking students to engage in collecting chicken feathers and the likes you would think they are being taught to become witchdoctors😅😂😅.",Fri Jun 16 20:34:37 +0000 2023,0,0
149,Waza News,"KRA has partnered with the Kenya Institute of Curriculum Development(KICD) to develop exclusive tax e-resources for CBC students to enhance their tax literacy.
https://t.co/p8o0PvwK63",Wed Mar 20 08:45:56 +0000 2024,0,0
150,TUKO.co.ke | The Heartbeat of Kenya,"Gatanga MP Edward Muriu has expressed his excitement after Parliament passed his motion that proposed the increment of students' capital from KSh 1,420 to KSh 7,760 per student. 

Muriu said the increased Allocation per student will factor in the new CBC education system, the https://t.co/fBMTsby7GD",Thu Oct 12 13:21:59 +0000 2023,1,2
151,The Kenya Times,"Peter Kaluma calls for a return to the 8-4-4 education system, citing a lack of facilities and resources to effectively implement the Competency Based Curriculum (CBC) in Kenya. 

Do you think primary schools have the required infrastructure to host grade nine students come https://t.co/JCysyyQ2pI",Wed Oct 23 07:43:02 +0000 2024,0,3
152,Nation Africa,"Learners undertaking CBC will from January 2029 go through a mandatory pre-higher education community service programme that will cumulatively see them spend 12 months working in their communities.
https://t.co/815hJZpcNP",Tue Aug 08 18:40:00 +0000 2023,11,27
153,CMS Ireland,"KENYA
Please pray for all school students in Kenya moving from primary into secondary schools for the first time under the new Competency Based Curriculum (CBC). This transition is not easy for the schools to manage. https://t.co/vQpAVigEKd",Mon Mar 20 06:00:01 +0000 2023,0,1
154,TUKO.co.ke | The Heartbeat of Kenya,"Teachers must be CBC-compliant.

Students are about to resume classes in the first term of 2023 as CBC advances in the academic curriculum.

The government has set conditions that must be met by schools that will host Junior Secondary School learners.
https://t.co/Wwb9IZ0sfT",Sat Jan 14 11:37:42 +0000 2023,1,1
155,Kithure Kindiki,"KAREN, NAIROBI, KENYA
TUESDAY, NOVEMBER 26, 2024

The Presidential Working Party on Education reforms calls for crucial reforms to firm up access and affordability of continuously relevant high quality education system, good enough to produce fit-for-purpose graduates for https://t.co/OMwz03wTyL",Tue Nov 26 12:06:25 +0000 2024,56,269
156,KTN News,"Kenya’s education sector is preparing for significant changes as the first cohort of students under the new Competency-Based Curriculum (CBC) transitions into Grade 9 this week.
https://t.co/kHxhGUg6o6",Mon Jan 06 08:20:11 +0000 2025,1,6
157,JANE KYALO,"2025 is a special year in Kenya's education calendar. 

High schools will not be admitting form 1 students, as we now work towards transitioning to the CBC curriculum fully in the next few years. 

Except for the few challenges caused by @EduMinKenya by the delay in giving out",Thu Jan 02 05:58:35 +0000 2025,1,2
158,Citizen TV Kenya,University of Kabianga closed after students riot over HELB delays https://t.co/q7hzgPmcni https://t.co/xct2EE6Aob,Tue Apr 04 18:47:57 +0000 2023,161,1850
159,Anyungu,"What value does it add for students in whatever grade to wake up at 4:30 AM to go and study 8-4-4 or 6-6-4 or whatever CBC is?

In today’s Kenya, grades are just 15% of you.

I mean even first class honors nowadays has no honor. 

Working too hard in school limits your potential.",Sat Mar 25 08:31:40 +0000 2023,18,79
160,Gabriel Oguda,"""CBC has been turned into a graveyard for Kenyan children. Where on Earth do you find a Gov't employing teachers on contract?"" - Leader of Minority, @OpiyoWandayi. https://t.co/1Fjfuc9p4a",Fri Dec 29 15:53:48 +0000 2023,119,522
161,Citizen TV Kenya,"Form Four students from various schools stranded at Uhuru Park, Nairobi. The students, who completed their KCSE exams today are unable to proceed to their homes due to the 8–4am curfew restrictions. https://t.co/UfQtd7hmS8",Mon Apr 19 18:00:48 +0000 2021,274,720
162,Citizen TV Kenya,18 university students head out to China to represent Kenya in Huawei Global ICT competition finals https://t.co/ZDBd91Zi22,Tue May 21 09:23:59 +0000 2024,328,1167
163,Citizen TV Kenya,Machakos University students protest over delayed disbursement of capitation money and HELB loans https://t.co/4AF2GmjQkf,Thu Nov 02 11:22:06 +0000 2023,35,317
164,Nation Africa,Learners undertaking the competency-based curriculum (CBC) will from January 2029 go through a mandatory pre-higher education community service programme that will cumulatively see them spend 12 months working in their communities. https://t.co/815hJZpcNP,Tue Aug 08 07:30:00 +0000 2023,3,24
165,TheStarKenya,The two institutions will develop exclusive tax e-resources for Competency-Based Curriculum students. https://t.co/2vc4A2nlXO,Tue Mar 19 19:16:07 +0000 2024,2,13
166,Citizen TV Kenya,"Speaking at the launch of the Gravity CBC/CBA  Model and Pathways and Careers  models designed to support students through their educational journey, the stakeholders encouraged the government to take inspiration from private sector practices.
https://t.co/Px61ee86qL",Sat Aug 17 20:01:09 +0000 2024,0,8
167,Africa story Live,"American University students are paying Kenyans thousands of Dollars monthly to do their thesis and assignment for them.

A CBS News investigation shows

Watch https://t.co/cjZBzQMk31",Thu May 12 06:43:14 +0000 2022,149,182
168,The Standard Digital,"How CBC platform is keeping students busy during holiday.

https://t.co/Bzs2NQvH01",Tue Nov 14 01:00:00 +0000 2023,1,0
169,Citizen TV Kenya,University of Kabianga closed after students riot over HELB delays https://t.co/DSDyAQJvCz https://t.co/UCKB1kByhY,Wed Apr 05 02:45:12 +0000 2023,144,895
170,The Standard Digital,"🌟 What’s next after CBC Grade 6? 🌟 

Join the International University Pathways College (IUPC) to dive into the internationally recognized IGCSE curriculum! This program not only equips students with essential skills but also opens doors to top universities around the globe. https://t.co/pCBrrZVa9U",Wed Oct 02 10:34:26 +0000 2024,1,1
171,NTV Kenya,"Performing Arts now mandatory in Kenya’s CBC – CS Ezekiel Machogu
https://t.co/KBHffkjPq8 https://t.co/xSniqIpEtZ",Tue Apr 16 08:01:39 +0000 2024,29,538
172,Citizen TV Kenya,"Peter Tabichi, the 2019 Global Teacher Prize winner, among team appointed by President Ruto to review CBC https://t.co/x7RWUptR5u https://t.co/eNCYir1uXv",Fri Sep 30 15:39:13 +0000 2022,105,1933
173,Kenyans.co.ke,CBC has never been taught in our classes - Wilson Sossion https://t.co/UJICJ4yAoH,Fri Sep 16 05:46:47 +0000 2022,92,1677
174,Rachel Strohm,"Bad news from #Kenya: the education ministry expects that the number of secondary school students will fall by over 20% in the next year, due to low donor funding but also the CBC curriculum reforms (!) https://t.co/jPbtWl6Num",Wed Apr 17 21:15:09 +0000 2024,2,0
175,Citizen TV Kenya,"Changes in public universities as diploma and certificate courses get eliminated, Education Ministry says programmes reserved for colleges and TVETs. https://t.co/WPuh6NTzWW",Fri Mar 01 16:41:13 +0000 2024,302,1128
176,CITY DIGEST.,"CBC Flix Kids brings you a singing competition which will be held at the Kenya National Theatre on 11th August. The ticket is sh.1000 for audiences and sh.500 for students.
Register and get tickets via https://t.co/rAuJpwQiQ9

Tirries Tuesday Mudryk Declan Rice Uhuru Kenyatta https://t.co/gJyapwXqN1",Tue Jun 20 13:33:05 +0000 2023,79,104
177,Citizen TV Kenya,"University students in Nairobi and Mombasa protest against the new funding model, claim it is discriminative https://t.co/y8ZzNXLdsu",Mon Sep 09 12:05:28 +0000 2024,58,206
178,Lord Abraham Mutai,This is an ATTACHMENT LETTER from @KBCChannel1 to a student. The student has to pay Ksh700 per month to be allowed to intern at KBC While their counterparts like BBC are paying interns. Kenya's leading government broadcasting body. THIS IS SLAVERY on a whole new level. SHAME! https://t.co/LKhuX3ONqx,Mon Oct 08 13:43:39 +0000 2018,367,398
179,Rethinking The Horn,"The same idiots are shouting loudest there is something wrong with education system in Kenya whilst doing 3 MA's and several PhDs for foreign western students. Alas cue in CBC... Kenyans want to be like the west, focus of a childs talents etc blah blah blah 🤣🤣🤣🤣",Thu Feb 15 21:01:55 +0000 2024,0,0
180,Kenyans.co.ke,"Nyambaria High School, 1 KCSE 2022 candidate scored B and the rest had B+ and above, sending all 488 candidates to the university https://t.co/uGJ83DfBk6",Sat Jan 21 09:57:38 +0000 2023,157,1927
181,Citizen TV Kenya,"University Funding Uproar:

Vulnerable students still face university fees burden

Josiah Ogachi's family unable to raise required Ksh 61,000

Ogachi placed in band 3 despite being needy

Ogachi scored grade 'A', admitted at Kenyatta University

His parents earn Ksh 3,000 monthly https://t.co/IxgxE11f93",Sun Aug 18 18:21:32 +0000 2024,193,433
182,Citizen TV Kenya,"University of Nairobi suspends classes with immediate effect following directive by President Kenyatta to curb spread of coronavirus, VC Stephen Kiama says. https://t.co/wOvIch6UXz",Sun Mar 15 17:36:40 +0000 2020,49,309
183,Citizen TV Kenya,"MPs Question How 16,000 Students Were Placed At Kisii University https://t.co/gm7J16KUfL https://t.co/oouyHPjxFx",Wed Jun 12 05:20:14 +0000 2024,18,277
184,Citizen TV Kenya,"Bungoma: Girl who scored 401 marks in KCPE goes back to repeat after being knocked out of county scholarship program
https://t.co/hCOiRw3Q7a",Wed Jul 28 13:46:38 +0000 2021,749,2233
185,Citizen TV Kenya,Parents fault gov't over non-inclusion in CBC taskforce https://t.co/dyakwwz5qR https://t.co/1L4yaejT4Z,Mon Oct 03 03:30:14 +0000 2022,24,621
186,Citizen TV Kenya,"Magoha Wants Incoming Gov’t To Give Him More Time To Complete CBC Classrooms 
https://t.co/OIul6RsBxB https://t.co/5CVl5TVv2D",Mon Aug 01 23:00:28 +0000 2022,61,1207
187,Citizen TV Kenya,"Nigerian teen gets 19 scholarship offers worth over Ksh.539M from US, Canada https://t.co/HRlUzqwBrN https://t.co/SMIdjBFpZo",Sun May 02 21:30:03 +0000 2021,40,536
188,Kenyans.co.ke,CS Magoha commissions phase two of the CBC classrooms at Mukumu Girls High School in Kakamega County https://t.co/yNwcjTFlSg,Sat Sep 03 07:48:22 +0000 2022,7,235
189,Citizen TV Kenya,"'CBC Was Introduced To Kill Public Schools,' Sossion Says
https://t.co/lWjwZgGGqr https://t.co/NJ6HsspwDv",Thu Jun 23 17:15:03 +0000 2022,9,289
190,Techweez,"The Kenya Revenue Authority (KRA) is ramping up efforts to expand the tax base. 

To achieve this, the Kenya Institute of Curriculum Development (KICD) and the Authority are developing exclusive e-resources on taxation for CBC students.

https://t.co/wKy6NakbBu",Wed Mar 20 07:20:57 +0000 2024,1,0
191,Citizen TV Kenya,Ruto offers scholarships for Comoros students to study in Kenya https://t.co/lvtTGx5Q92,Thu Jul 06 16:24:00 +0000 2023,15,384
192,Kiptoo,"USAID played a cricital role in the forceful implemention of CBC in Kenya. unfortunately, Uhuru, Ruto, matiangi, belio kipsang and the late Prof Magoha ate all the money. Now your kids are wasting their time in school while the publishers of CBC books are making billions.",Sat Feb 08 14:57:40 +0000 2025,10,17
193,MK,"So last term, my 7-year-old made it to the Nationals level of the Kenya music festivals and still managed to come second in the whole stream. (They only recognize the first 3 students, I think it’s a CBC thing) The challenge we’re having is that she’s a noisemaker in class.",Tue Sep 24 12:35:31 +0000 2024,0,3
194,Kenyans.co.ke,CBC is a fraudulent curriculum that is being forced on the nation of Kenya. - Wilson Sossion https://t.co/5BC72wcb5E,Wed Aug 25 06:17:33 +0000 2021,196,708
195,Citizen TV Kenya,"CS Magoha: 90% Of 2021 KCSE Students Who Scored Over C+ Placed In Universities 
https://t.co/Kt6xnipDnL https://t.co/oJMQQ8ORl1",Sat Jun 25 16:06:13 +0000 2022,15,223
196,KBC Channel 1 News,"Kenya Universities Student Organizations (KUSO) has resoluted support for the affordable housing program. 
#KBCniYetu ^RO https://t.co/Mwqq9GGBk6",Sat Jan 06 10:18:10 +0000 2024,78,727
197,TheStarKenya,"Storm is brewing in the education sector after a teachers' union sought reversal of a directive to domicile Grade 7 students in primary schools
https://t.co/J3mubqTbFQ",Wed Mar 08 02:44:43 +0000 2023,4,24
198,Citizen TV Kenya,"201,133 KCSE candidates meet university cut-off grade after scoring C+ and above; CS Machogu says 96,235 are female and 104,898 are male. https://t.co/w8X6Bhlgg2",Mon Jan 08 08:58:07 +0000 2024,36,397
199,Citizen TV Kenya,"Student fails to join Kapsabet Boys due to lack of fees, Kiprono scored 417 marks in last year’s KCPE exams #CitizenLiveAt1 w/ @Joey_Muthengi https://t.co/udQRivF5M9",Wed Jan 10 10:07:49 +0000 2018,94,196
200,Citizen TV Kenya,"2021 Top KCSE Student, Jeriel Obura, Wants To Study Medicine At Maseno University https://t.co/V37bA1EEiN https://t.co/tI87yM5RWi",Sun Apr 24 03:00:04 +0000 2022,16,305
201,Citizen TV Kenya,"CS Magoha:  The schools that have been destroyed or damaged, the children will be moved to other schools. Those in the final year in Universities, can go ahead &amp; do practical's in adherence to COVID-19 protocols. We are soon working on TTC’s &amp; finalizing teachers training on CBC https://t.co/vd1c8nSfIB",Mon Sep 21 08:36:59 +0000 2020,55,415
202,Citizen TV Kenya,Students to pay from Ksh.105K for online degrees at Open University of Kenya https://t.co/mJdMw8BeEl,Mon Aug 28 13:50:23 +0000 2023,215,1996
203,Citizen TV Kenya,"Machakos Police Officers Come To The Aid Of Needy Student Who Scored 403 Marks In KCPE
https://t.co/VnKagCdZgo https://t.co/pHMljIiEYG",Thu May 19 03:15:02 +0000 2022,106,1216
204,Charles Jb (Cane Cutter),"Still on CBC in Kenya, I see a number of students dropping out of grade 9 next year or becoming uncontrollable.

The mood among many students in grade 8 is that they would want  a change of environment.",Tue Sep 24 14:42:25 +0000 2024,0,0
205,Citizen TV Kenya,Kakamega: Private schools opt for International Curriculum if CBC is scrapped off https://t.co/nK8O8GCrsF https://t.co/lPraZ7WuSP,Sun Sep 18 20:15:15 +0000 2022,19,448
206,Kenyans.co.ke,Education CS nominee Ezekiel Machogu's take on the cost of CBC https://t.co/Drx377HiM0,Fri Oct 21 13:46:07 +0000 2022,30,277
207,Citizen TV Kenya,"Kenyatta University students protest for ‘being forced to use fly over’
 https://t.co/jfOKDJBaWN",Mon Oct 07 13:55:43 +0000 2019,30,200
208,Uchumi Bora,"People who are eagerly waiting to clobber Ruto at the ballot.

•Catholic Church 
•Salaried Kenyans 
•Men in Uniform 
•University Students 
•SMEs
•Gen Z
•CBC parents 
•Maize, tea &amp; coffee Farmers
•Mt Kenya voters

It amounts to 78% of the total votes that will be cast.",Fri Jan 31 04:50:33 +0000 2025,6,10
209,Citizen TV Kenya,"President Kenyatta creates new state department under Education ministry to implement, monitor and fast track CBC reforms https://t.co/AH0UlyJQSX",Tue Feb 09 13:55:03 +0000 2021,39,444
210,Citizen TV Kenya,KCSE: Joy as little-known secondary school in Trans Nzoia sends all candidates to university https://t.co/D93cC0cCV2,Sun Jan 22 05:55:57 +0000 2023,5,228
211,Citizen TV Kenya,"Kenyatta University students head home following closure of campus over student unrest and ongoing lecturer's strike. 

#KUClosed https://t.co/kiJ5hYaddw",Fri Nov 17 07:38:37 +0000 2017,48,115
212,"NGETICH,HSC",Kenyan teachers have vowed to vote Kenya kwanza brigade  so that CBC is scrapped,Tue Feb 15 07:11:23 +0000 2022,14,267
213,Naomi Waithira,"People who are eagerly waiting to clobber Ruto at the ballot.

•Catholic Church 
•Salaried Kenyans 
•Men in Uniform 
•University Students 
•SMEs
•Gen Zs
•CBC parents 
•Maize, tea &amp; coffee Farmers
•Mt Kenya voters sanaaaa.
 
ADD ON THE LIST.........",Fri Jan 31 13:41:22 +0000 2025,27,79
214,Citizen TV Kenya,"President Ruto Appoints 42-Member Taskforce To Evaluate CBC - Here Are The Members
https://t.co/tcnhHRWCdf https://t.co/gdihBcIFF8",Sat Oct 01 21:00:14 +0000 2022,8,194
215,Kijana ya Igembe,"People who are eagerly waiting to clobber Ruto at the ballot.
•Catholic Church 
•Salaried Kenyans 
•Men in Uniform 
•University Students 
•SMEs
•Gen Z
•CBC parents 
•Maize, tea &amp; coffee Farmers
•Mt Kenya voters
 Nairobi CBD
#RutoMustGoForward
#planecrash",Thu Jan 30 19:42:13 +0000 2025,1,2
216,Citizen TV Kenya,"CBC children are the happiest in Kenya as they are not stressed by exams and the assessments given are friendlier, KEPSA Chair Nzioka says https://t.co/r0gT6K7TnA",Tue Sep 14 07:19:15 +0000 2021,23,314
217,Kenyans.co.ke,"KBC rebrands with new studio, new and veteran anchors joining the team. Including Catherine Kasavuli and Badi Muhsin. https://t.co/WIhL14sC0D",Mon Jun 21 10:36:26 +0000 2021,48,488
